{
"RequestId": 654567898765434,
  "Operation": "Create",
  "Type": "MSSContactAssignment",
  "Data": {
    "CustomerAccountId": "300000003444564",
    "PartyId": "300000003444540",

      "CustomerAccountContact": {
        "CustomerAccountId": "300000003444564",
        "PrimaryFlag": false,
        "RoleType": "CONTACT",
        "CreatedByModule": "SIS",
        "RelationshipId": "300000003444691",
        "CustomerAccountContactRole": {
          "ResponsibilityType": "BILL_TO",
          "PrimaryFlag": true,
          "CreatedByModule": "SIS"
        }
      
    }
  }
}